{
  "id": "aG88rL",
  "ifsId": "A9CEizp",
  "entityType": "Member",
  "name": "E",
  "roles": [],
  "permissions": [
    {
      "id": "rlcAKXsm",
      "ifsId": "HVlSCV9",
      "entityType": "Permission",
      "name": "Uj",
      "actorId": "zpj",
      "scopeId": "JhqdM1o",
      "scope": {},
      "state": "drafted",
      "createdAt": "2022-05-10T16:57:55Z",
      "expiresAt": "2028-11-29T02:02:52Z"
    }
  ],
  "isOwner": true,
  "createdAt": "2027-07-30T16:09:40Z",
  "updatedAt": "2029-02-28T03:23:07Z"
}